{
  "evaluation_version": "generation-eval-v1",
  "dataset_status": "verified",
  "source_retrieval_eval_sha256": "659c5cd0ff378747b9b135df00be57e5c1f5681b7eede761d3ce5808afbf3c62",
  "items": [
    {
      "query_id": "eval001",
      "query": "Các mức phân loại rủi ro của hệ thống trí tuệ nhân tạo gồm những mức nào?",
      "split": "eval",
      "answerability": "answerable",
      "required_points": [
        {
          "point_id": "P1",
          "description": "Rủi ro cao: có thể gây thiệt hại đáng kể đến các lợi ích được luật bảo vệ.",
          "importance": "required",
          "supporting_chunk_ids": [
            "134-2025-QH15_dieu-9_khoan-1_diem-a"
          ]
        },
        {
          "point_id": "P2",
          "description": "Rủi ro trung bình: có thể gây nhầm lẫn, tác động hoặc thao túng vì người sử dụng không nhận biết được AI hoặc nội dung AI.",
          "importance": "required",
          "supporting_chunk_ids": [
            "134-2025-QH15_dieu-9_khoan-1_diem-b"
          ]
        },
        {
          "point_id": "P3",
          "description": "Rủi ro thấp: không thuộc trường hợp rủi ro cao hoặc trung bình.",
          "importance": "required",
          "supporting_chunk_ids": [
            "134-2025-QH15_dieu-9_khoan-1_diem-c"
          ]
        }
      ],
      "reference_answer": "Gồm rủi ro cao (có thể gây thiệt hại đáng kể), trung bình (có thể gây nhầm lẫn, tác động hoặc thao túng vì không nhận biết AI/nội dung AI), và thấp (không thuộc hai trường hợp trên).",
      "annotation_notes": "Generation Annotation Audit v1 applied; annotation remains draft. Ba chunks liệt kê trực tiếp từng mức.",
      "annotation_confidence": "high",
      "annotation_status": "verified"
    },
    {
      "query_id": "eval002",
      "query": "Ai có thẩm quyền ban hành danh mục hệ thống trí tuệ nhân tạo có rủi ro cao?",
      "split": "eval",
      "answerability": "answerable",
      "required_points": [
        {
          "point_id": "P1",
          "description": "Thủ tướng Chính phủ có thẩm quyền ban hành, sửa đổi, bổ sung Danh mục hệ thống AI có rủi ro cao.",
          "importance": "required",
          "supporting_chunk_ids": [
            "142-2026-ND-CP_dieu-7_khoan-2_diem-d"
          ]
        },
        {
          "point_id": "P2",
          "description": "Bộ Khoa học và Công nghệ chủ trì phối hợp xây dựng và trình Danh mục trên cơ sở tiêu chí, nguyên tắc của Nghị định.",
          "importance": "important",
          "supporting_chunk_ids": [
            "142-2026-ND-CP_dieu-7_khoan-2_diem-d"
          ]
        }
      ],
      "reference_answer": "Thủ tướng Chính phủ là người có thẩm quyền ban hành, sửa đổi, bổ sung Danh mục hệ thống AI có rủi ro cao. Bộ Khoa học và Công nghệ chủ trì phối hợp xây dựng và trình Danh mục.",
      "annotation_notes": "Generation Annotation Audit v1 applied; annotation remains draft. Giữ phân biệt chủ thể trình và ban hành.",
      "annotation_confidence": "high",
      "annotation_status": "verified"
    },
    {
      "query_id": "eval003",
      "query": "Nhà cung cấp phải lập hồ sơ phân loại rủi ro vào thời điểm nào?",
      "split": "eval",
      "answerability": "answerable",
      "required_points": [
        {
          "point_id": "P1",
          "description": "Trước khi đưa hệ thống rủi ro cao hoặc trung bình vào sử dụng.",
          "importance": "required",
          "supporting_chunk_ids": [
            "142-2026-ND-CP_dieu-12_khoan-1"
          ]
        }
      ],
      "reference_answer": "Trước khi đưa hệ thống vào sử dụng, đối với hệ thống AI rủi ro cao và trung bình.",
      "annotation_notes": "Generation Annotation Audit v1 applied; annotation remains draft. Nêu cả thời điểm và phạm vi.",
      "annotation_confidence": "high",
      "annotation_status": "verified"
    },
    {
      "query_id": "eval004",
      "query": "Nhà cung cấp hệ thống AI rủi ro cao phải duy trì những biện pháp quản lý nào?",
      "split": "eval",
      "answerability": "answerable",
      "required_points": [
        {
          "point_id": "P1",
          "description": "Thiết lập và duy trì hệ thống quản lý rủi ro phù hợp với mục đích, phạm vi triển khai và mức độ rủi ro.",
          "importance": "required",
          "supporting_chunk_ids": [
            "142-2026-ND-CP_dieu-15_khoan-1"
          ]
        },
        {
          "point_id": "P2",
          "description": "Xác định và đánh giá các rủi ro có thể phát sinh đối với quyền, an toàn, an ninh hoặc lợi ích công cộng.",
          "importance": "required",
          "supporting_chunk_ids": [
            "142-2026-ND-CP_dieu-15_khoan-2_diem-a"
          ]
        },
        {
          "point_id": "P3",
          "description": "Bảo đảm chất lượng, tính phù hợp và tính đại diện của dữ liệu huấn luyện, kiểm thử và đánh giá trong phạm vi cần thiết.",
          "importance": "required",
          "supporting_chunk_ids": [
            "142-2026-ND-CP_dieu-15_khoan-2_diem-b"
          ]
        },
        {
          "point_id": "P4",
          "description": "Thiết kế và duy trì cơ chế giám sát, can thiệp của con người phù hợp với mức độ rủi ro.",
          "importance": "required",
          "supporting_chunk_ids": [
            "142-2026-ND-CP_dieu-15_khoan-2_diem-c"
          ]
        },
        {
          "point_id": "P5",
          "description": "Áp dụng biện pháp kỹ thuật hoặc quản lý để phòng ngừa, hạn chế hoặc kiểm soát rủi ro đã xác định.",
          "importance": "required",
          "supporting_chunk_ids": [
            "142-2026-ND-CP_dieu-15_khoan-2_diem-d"
          ]
        },
        {
          "point_id": "P6",
          "description": "Rà soát và cập nhật biện pháp quản lý rủi ro khi mô hình, dữ liệu, phương thức vận hành hoặc mục đích sử dụng thay đổi đáng kể.",
          "importance": "required",
          "supporting_chunk_ids": [
            "142-2026-ND-CP_dieu-15_khoan-2_diem-đ"
          ]
        }
      ],
      "reference_answer": "Phải duy trì hệ thống quản lý rủi ro phù hợp mục đích, phạm vi và mức rủi ro; nhận diện rủi ro, bảo đảm dữ liệu phù hợp trong phạm vi cần thiết, có giám sát/can thiệp con người và biện pháp kiểm soát. Rà soát, cập nhật khi mô hình, dữ liệu, vận hành hoặc mục đích thay đổi đáng kể.",
      "annotation_notes": "Generation Annotation Audit v1 applied; annotation remains draft. Giữ điều kiện tương xứng và thay đổi đáng kể.",
      "annotation_confidence": "high",
      "annotation_status": "verified"
    },
    {
      "query_id": "eval005a",
      "query": "Nhà cung cấp hệ thống trí tuệ nhân tạo có rủi ro cao phải thực hiện những nghĩa vụ quản lý nào?",
      "split": "eval",
      "answerability": "answerable",
      "required_points": [
        {
          "point_id": "P1",
          "description": "Nhà cung cấp phải thiết lập, duy trì và rà soát biện pháp quản lý rủi ro khi có thay đổi đáng kể hoặc rủi ro mới.",
          "importance": "required",
          "supporting_chunk_ids": [
            "134-2025-QH15_dieu-14_khoan-1_diem-a"
          ]
        },
        {
          "point_id": "P2",
          "description": "Nhà cung cấp phải quản trị dữ liệu huấn luyện, kiểm thử và vận hành, bảo đảm chất lượng trong phạm vi khả năng kỹ thuật và phù hợp mục đích sử dụng.",
          "importance": "required",
          "supporting_chunk_ids": [
            "134-2025-QH15_dieu-14_khoan-1_diem-b"
          ]
        },
        {
          "point_id": "P3",
          "description": "Nhà cung cấp phải lập, cập nhật, lưu giữ hồ sơ kỹ thuật và nhật ký ở mức cần thiết; cung cấp thông tin cần thiết, tương xứng cho kiểm tra nhưng không làm lộ bí mật kinh doanh.",
          "importance": "required",
          "supporting_chunk_ids": [
            "134-2025-QH15_dieu-14_khoan-1_diem-c"
          ]
        },
        {
          "point_id": "P4",
          "description": "Nhà cung cấp phải thiết kế hệ thống bảo đảm khả năng giám sát và can thiệp của con người.",
          "importance": "required",
          "supporting_chunk_ids": [
            "134-2025-QH15_dieu-14_khoan-1_diem-d"
          ]
        },
        {
          "point_id": "P5",
          "description": "Nhà cung cấp phải thực hiện nghĩa vụ minh bạch và xử lý sự cố.",
          "importance": "required",
          "supporting_chunk_ids": [
            "134-2025-QH15_dieu-14_khoan-1_diem-đ"
          ]
        },
        {
          "point_id": "P6",
          "description": "Nhà cung cấp phải giải trình và cung cấp thông tin cần thiết cho cơ quan, người sử dụng và người bị ảnh hưởng; việc cung cấp không được bộc lộ mã nguồn, thuật toán chi tiết, tham số, bí mật kinh doanh hoặc bí mật công nghệ.",
          "importance": "required",
          "supporting_chunk_ids": [
            "134-2025-QH15_dieu-14_khoan-1_diem-e"
          ]
        },
        {
          "point_id": "P7",
          "description": "Nhà cung cấp phải phối hợp với cơ quan nhà nước có thẩm quyền và bên triển khai trong kiểm tra, đánh giá, hậu kiểm và khắc phục sự cố.",
          "importance": "required",
          "supporting_chunk_ids": [
            "134-2025-QH15_dieu-14_khoan-1_diem-g"
          ]
        }
      ],
      "reference_answer": "Phải quản lý rủi ro, quản trị dữ liệu trong khả năng kỹ thuật và đúng mục đích, lưu giữ hồ sơ/nhật ký cần thiết, bảo đảm giám sát con người, minh bạch, xử lý sự cố, giải trình và phối hợp kiểm tra, hậu kiểm, khắc phục. Cung cấp thông tin không được buộc lộ bí mật kinh doanh/công nghệ.",
      "annotation_notes": "Generation Annotation Audit v1 applied; annotation remains draft. Bảo lưu giới hạn kỹ thuật, tính cần thiết và bí mật.",
      "annotation_confidence": "high",
      "annotation_status": "verified"
    },
    {
      "query_id": "eval005b",
      "query": "Bên triển khai hệ thống trí tuệ nhân tạo có rủi ro cao phải thực hiện những nghĩa vụ quản lý nào?",
      "split": "eval",
      "answerability": "answerable",
      "required_points": [
        {